{
  "decision_id": "PREFREEZE_DIAG_20260819_D000589",
  "run_id": "PREFREEZE_DIAG_20260819",
  "timestamp": "2026-08-19T07:10:09Z",
  "entity_type": "run",
  "entity_id": "PREFREEZE_DIAG_20260819",
  "decision_type": "bounded-diagnostic-pause",
  "field": "status",
  "old_value": "running",
  "new_value": "paused",
  "reason": "The bounded source-only diagnostic is fully classified and validated, but it cannot be marked complete because the package is pre-freeze and all registered discovery/stopping frontiers were intentionally excluded from scope.",
  "source_location": "runs/PREFREEZE_DIAG_20260819/run_summary.md",
  "agent": "codex-desktop/gpt-5"
}
